{
  "$schema": "../model/game-state.schema.json",
  "schemaVersion": 1,
  "fixtureScope": "transition",
  "gameKey": "ticket-to-ride-europe-base",
  "phase": "tunnel_payment",
  "revision": 18,
  "turnOrder": [
    "p1",
    "p2"
  ],
  "currentPlayerId": "p1",
  "players": [
    {
      "id": "p1",
      "seatIndex": 0,
      "status": "active",
      "score": 12,
      "trainsRemaining": 38,
      "stationsRemaining": 3,
      "trainHand": [
        {
          "instanceId": "train-green-04",
          "typeId": "train-green"
        },
        {
          "instanceId": "train-green-05",
          "typeId": "train-green"
        },
        {
          "instanceId": "train-locomotive-03",
          "typeId": "train-locomotive"
        }
      ],
      "destinationTicketIds": [
        "ticket-regular-011",
        "ticket-regular-021"
      ],
      "initialTicketChoiceSubmitted": true,
      "finalStationAssignmentSubmitted": false
    },
    {
      "id": "p2",
      "seatIndex": 1,
      "status": "active",
      "score": 9,
      "trainsRemaining": 40,
      "stationsRemaining": 2,
      "trainHand": [
        {
          "instanceId": "train-red-02",
          "typeId": "train-red"
        },
        {
          "instanceId": "train-blue-06",
          "typeId": "train-blue"
        }
      ],
      "destinationTicketIds": [
        "ticket-long-002",
        "ticket-regular-013"
      ],
      "initialTicketChoiceSubmitted": true,
      "finalStationAssignmentSubmitted": false
    }
  ],
  "trainDeck": [
    {
      "instanceId": "train-yellow-08",
      "typeId": "train-yellow"
    },
    {
      "instanceId": "train-white-09",
      "typeId": "train-white"
    }
  ],
  "trainDiscard": [
    {
      "instanceId": "train-orange-01",
      "typeId": "train-orange"
    }
  ],
  "faceUpMarket": [
    {
      "instanceId": "train-red-07",
      "typeId": "train-red"
    },
    {
      "instanceId": "train-black-11",
      "typeId": "train-black"
    },
    {
      "instanceId": "train-blue-03",
      "typeId": "train-blue"
    },
    {
      "instanceId": "train-yellow-02",
      "typeId": "train-yellow"
    },
    {
      "instanceId": "train-locomotive-05",
      "typeId": "train-locomotive"
    }
  ],
  "destinationDeck": [
    "ticket-regular-001",
    "ticket-regular-002"
  ],
  "removedDestinationTicketIds": [
    "ticket-long-006"
  ],
  "claimedRoutes": [
    {
      "routeId": "route-bruxelles-paris-a",
      "ownerPlayerId": "p1"
    },
    {
      "routeId": "route-bruxelles-frankfurt",
      "ownerPlayerId": "p2"
    }
  ],
  "stationPlacements": [
    {
      "cityId": "bruxelles",
      "ownerPlayerId": "p2",
      "borrowedRouteId": null
    }
  ],
  "pendingTicketChoice": null,
  "pendingTunnel": {
    "actorPlayerId": "p1",
    "routeId": "route-paris-zurich",
    "declaredColor": "green",
    "initialCards": [
      {
        "instanceId": "train-green-01",
        "typeId": "train-green"
      },
      {
        "instanceId": "train-green-02",
        "typeId": "train-green"
      },
      {
        "instanceId": "train-locomotive-01",
        "typeId": "train-locomotive"
      }
    ],
    "revealedCards": [
      {
        "instanceId": "train-green-09",
        "typeId": "train-green"
      },
      {
        "instanceId": "train-red-08",
        "typeId": "train-red"
      },
      {
        "instanceId": "train-locomotive-08",
        "typeId": "train-locomotive"
      }
    ],
    "extraCost": 2,
    "paymentMode": "declared-color",
    "status": "awaiting_payment"
  },
  "finalRound": null,
  "result": null,
  "eventSequence": 27,
  "history": [
    {
      "sequence": 27,
      "type": "tunnel_cards_revealed",
      "actorPlayerId": "p1",
      "publicMessage": "玩家 1 的隧道额外费用为 2 张。"
    }
  ]
}
